1336848703392.52,,Sat May 12 2012 20:51:43 GMT+0200 (CEST),,The University of Leicester ,United Kingdom,Leicester,Museum|University Museum Studies Department,Art|Archeology|Dinosaur Gallery & Space,"National, History and Art Museums|Science and Technology|Dinosaur Gallery & Space",2006,http://www2.le.ac.uk/,CIID,CIID,,,LIVE!Labels,Interaction,2006,"Ross Parry, and Mayra Ortiz-Williams, University of Leicester; and Andrew Sawyer, Simulacra  ","http://www.museumsandtheweb.com/mw2007/papers/parry/parry.html
http://www.xor.co.uk/ll.php",,"A seven-month partnership between the University of Leicester and Simulacra with three UK museums (New Walk Museum and Art Gallery, Dinosaur Gallery, and National Space Centre) resulted in the production and evaluation of a digital, wireless, editable and dynamic labeling system (with web-based authoring tool) for on-site museum exhibits called “LIVE!Labels.”","Interpretation - (curatorial tool, catalogue) - key function of technologies is to help in the exposition of existing informational platforms",On Site - near objects and exhibits,During the vist - enhancing visitor experience,Text,,"Audience / Public - the application is outward facing, intended as an experience for the general public, or specific community groups","A number of museum technologies such as iPod tours involve replacing the traditional method of museum interpretation - labels. This project uses this familiar form, but alters it, making it both easier for curators to edit, and opening up the possibility of visitors adding their input. This technology could revolutionise museum display.",Users benefit from up-to-date knowledge and interpretation. Some applications allow users to edit the content themselves.,"The project allows curators to edit the content of labels, and therefore takes advantage of their experise and ongoing learning. The labels could also be used to provide innovative labels that could become an attraction in their own right - e.g. those edited by users, edited to a theme of the day, to keep up with current affairs etc. ",,Passive Content Consumption,4,Immersive (focused on making visitors experience something),4,2,,This aspect of the analysis is not significant for the present case,8) None of the above,Not applicable,Not applicable,This aspect of the analysis is not significant for the present case,Not Applicable,Not Applicable,2
1336849313021.27,,Sat May 12 2012 21:01:53 GMT+0200 (CEST),,Indianapolis Museum of Art,United States of America,Indianapolis,Museum,Art,"National, History and Art Museums",2010,http://www.imamuseum.org/,CIID,CIID,,,Dashboard,An ongoing effort to measure various aspects of the Museum\\,2010,Undefined,"http://dashboard.imamuseum.org/
http://www.imamuseum.org/blog/2009/11/24/transparency-and-museums-part-4-transparency-in-practice/
http://www.flickr.com/photos/caseorganic/2899936013/",,"The IMA Dashboard is a website showing various aspects of the Museum\'s performance, for example, visitor numbers, energy consumption and endowment value. This information is quantified, shared with, and monitored by members of the public, Museum Studies students and colleagues in the museums sector. Visitors to the website are encouraged to comment on the Museum\'s progress. ","Communication - (website) - the project or application functions to convey, present or promote the activities of the project or institution",Off Site - virtual visits,Before the Visit - preparation prior to the visit|After the Visit - to support or deepen understandings following the visit,Text|Image,,"Audience / Public - the application is outward facing, intended as an experience for the general public, or specific community groups","Target group - Museum community


The majority of museum websites share information about the collection with the kind of information found on Dashboard relatively hidden in corporate reports. The impact of this organisational transparency would be interesting to monitor.","Users can access information about the museum for a variety of purposes. For example, Museum Studies students could find data for reports, patrons can measure the impact of their support and others can satisfy their curiosity.",The institution could benefit from positive PR for organisational transparency. Providing this information to the public focuses Museum staff on the targets they are working towards. The website also allows for feedback that could be used in evaluation.,,Interaction with Contents,4,Reflective (focused on engaging visitors cognitively),5,4,,This aspect of the analysis is not significant for the present case,8) None of the above,Not applicable,Not applicable,This aspect of the analysis is not significant for the present case,Yes,Not Applicable,2
1336849701111.44,,Sat May 12 2012 21:08:21 GMT+0200 (CEST),,San Jose Museum of Art,United States of America,San Jose,Museum,Art,Contemporary Art,2007,http://www.sjmusart.org/,CIID,CIID,,,Digital Dacha Murals,Digital Art & Interactive,2007,Undefined,http://www.youtube.com/watch?v=Wri72KA_lK8,,"San Jose Museum Museum of Art featured three interactive projected mural installations between 2007 and 2008. The first mural, \'Affinity\', involved using computer vision and optical flow to track the position of passing visitors. Within a moving digital mural of dots, certain dots represented these visitors and moved in-sync with them. Not all visitors worked out the relationship between themselves and the artwork. The second piece, \'Blueprint\', was related to the work of artists Il Lee who creates abstract and expressive pieces with ballpoint Bic pens. This piece used visitor-generated drawings (produced with web tablet and stylus) as the \""pixel\"" of the video, then used these to create representations of their movement. In real-time this video is redrawn in Bic blue on white and projected into the same space that it was captured in as a \""magic mirror\"". The third piece, \'Wishing Wall\', asks visitors \'What do you wish for?\' They are invited to answer this question by leaving a message on an antique phone. Visual representations of the messages are created dynamically in real time and this visualization is projected on a large wall facing the wishing audience. The messages can be heard by picking up another phone under the projection. ",Featured - (exhibited) - novel or a novel application of technologies are in-themselves the primary feature of the project or exhibition,On Site - in dedicated areas,During the vist - enhancing visitor experience,Audio|Image|Video,,"Audience / Public - the application is outward facing, intended as an experience for the general public, or specific community groups","San Jose Museum of Art commissioned digital artists to create a piece that related to the Museum\'s current exhibition. By placing these interactive murals in a central hallway they engaged visitors in a creative, as well as passive, act in the museum.","In the first piece, not all visitors recognised the relationship between their movements and those of the dots, but experimented with it to find out how it worked. ",The institution used these murals as feature pieces at exhibition opening nights. One commission turned into three based on their success.,,Interaction with Contents,5,Immersive (focused on making visitors experience something),2,1,,"A plural representation, mindful to multiple (and dissenting) voices of individuals",1) Multi-Cultural Storytelling - representing different cultures alongside but separate to one another,Not applicable,Not applicable,This aspect of the analysis is not significant for the present case,Not Applicable,Yes,2
1336850554914.31,,Sat May 12 2012 21:22:34 GMT+0200 (CEST),,You Are Not Here,United States of America,New York,Platform for urban tourism,Cities,"National, History and Art Museums|Cities",2006,http://www.youarenothere.org/,CIID,CIID,,,You Are Not Here,Cities,2006,"Mushon Zer-Aviv, Dan Phiffer, Kati London, Laila El-Haddad, Thomas Duc","http://www.youarenothere.org/
http://www.t-r-a-c-e-s.net/component/content/article/8-migratingresistance/207-you-are-not-here
http://www.softborders.art.br/festival/trab-mushon.php",,"\'You Are Not Here (.org) is a platform for urban tourism mash-ups. It invites participants to become meta-tourists on simultaneous excursions through multiple cities. Passers-by stumble across the curious You Are Not Here signs in the street. The YANH street-signs provide the telephone number for the Tourist Hotline, a portal for audio-guided tours of one place on the streets of another. Through investigation of these points and with or without the aid of a downloadable map, local pedestrians are transformed into tourists of foreign places. Current walking tours include Baghdad through the streets of New York City and Gaza City through the streets of Tel-Aviv.\'",Featured - (exhibited) - novel or a novel application of technologies are in-themselves the primary feature of the project or exhibition,Off Site - not related to museum premises,After the Visit - to support or deepen understandings following the visit,Audio|Image,,"Audience / Public - the application is outward facing, intended as an experience for the general public, or specific community groups","The project encourages intercultural understanding between conflicted communities. One of the creators speaks of wanting to \""to bridge over the distance that is not geographically large but is very much so from an emotional point of view.\""","The creators hope that the project will: - enable uses of the tour in Tel-Aviv to \'enter the consciousness of the average Gazan\' - leave \'virtual visitors ... with images of Palestinians eating, playing and socialising, making it harder for them to consider the people of Gaza as a faceless entity.\' - show Gaza as more than a tragedy ","The online version of \'You Are Not Here\' provides a durable communication platform for the project, which was originally on show as an exhibition. ",,Passive Content Consumption,2,Reflective (focused on engaging visitors cognitively),5,5,,This aspect of the analysis is not significant for the present case,8) None of the above,Not applicable,People from different cultures as those represented,"Both, with respect to different parts of the museum/exhibition/project",Yes,Yes,1
1336898128349.91,,Sun May 13 2012 10:35:28 GMT+0200 (CEST),, Brooklyn Historical Society,United States of America,New York,Historical Society,Urban / Brooklyn history center,Local,2008,http://www.brooklynhistory.org/default/index.html,CIID,CIID,,,In Pursuit of Freedom,City contexts,2008,"Brooklyn Historical Society, Weeksville Heritage Center and Irondale Ensemble Project","http://brooklynhistory.org/exhibitions/ipof.html
http://brooklynian.com/forum/listings/in-pursuit-of-freedom-irondale-wbrooklyn-historical-society-weeksville",,A series of 20 site-specific markers that illuminate Brooklyn\'s relationship to abolitionism. At night the markers illuminate and offer a connection to large immersive projections originating from lampposts. Visitors can also listen to contemporary audio recordings recreated from the papers of local Brooklyn Abolitionists via embedded headphone jacks or SMS on their phone. ,Featured - (exhibited) - novel or a novel application of technologies are in-themselves the primary feature of the project or exhibition,Off Site - not related to museum premises,During the vist - enhancing visitor experience,Audio|Image,,"Audience / Public - the application is outward facing, intended as an experience for the general public, or specific community groups","Local history societies have strong relationships with their area\'s geography. One of the standard ways in which they share an area\'s history is through tours (whether guided or self-guided). This project adds an extra dimension, and a digital art element, to this experience.",The images \'allow viewers to imagine the lives and activities that once existed in the space in which they now stand.\' The projections also reached passers-by who could be encouraged to interact further with the project and the Brooklyn Historical Society. ,The project aims to memorialize the history of abolitionism and the Underground Railroad in Brooklyn. The Brooklyn Historical Society were able to use some of the extraordinary artifacts and documents in their collection for this project. ,,Passive Content Consumption,5,Reflective (focused on engaging visitors cognitively)|Immersive (focused on making visitors experience something),5,4,,This aspect of the analysis is not significant for the present case,8) None of the above,Not applicable,"Both, with respect to different parts of the museum/exhibition/project",Emphasis on the protection of the identity and memory of the culture/s represented (nationalism and patriotism),Yes,Yes,2
1336899925409.35,,Sun May 13 2012 11:05:25 GMT+0200 (CEST),,Metropolitan Museum of Art,United States of America,New York,Museum,Art|Archeology,"National, History and Art Museums",2011,http://www.metmuseum.org/,CIID,CIID,,,Connections,The Metropolitan Museum of Art\\,2011,Undefined,"http://www.metmuseum.org/connections/
http://www.artdaily.org/index.asp?int_sec=2&int_new=43925
http://kateshanley.wordpress.com/2011/01/07/connections-the-metropolitan-museum-of-art/",,"\'The Metropolitan Museum of Art\'s Connections invites its diverse staff to offer their personal perspectives on works of art in the Museum\'s vast collection. Their voices range from the authoritative to the highly subjective, and touch upon any number of themes and concepts.\' ","Communication - (website) - the project or application functions to convey, present or promote the activities of the project or institution",Off Site - virtual visits,Before the Visit - preparation prior to the visit|After the Visit - to support or deepen understandings following the visit|Independent from the Visit - no relation to the visit ,Audio|Image|Video,,"Audience / Public - the application is outward facing, intended as an experience for the general public, or specific community groups","The Metropolitan Museum uses its website to create connections between the Museum, its members of staff, and those who visit it. The journeys through the collection are more driven by broad, personal experiences than traditional art history. ","Connections is a series that users can follow across the year. The Metropolitan hopes that their audience will be inspired to look at the collections in a new way, and think about their own connections with the pieces of art.",The project makes new connections across the collections by using themes chosen by staff members. The project empowers staff members who may not have traditionally been consulted about their response to the pieces in the gallery.,,Interaction with Contents,4,Reflective (focused on engaging visitors cognitively),5,2,,"A plural representation, mindful to multiple (and dissenting) voices of individuals",8) None of the above,Not applicable,"Both, with respect to different parts of the museum/exhibition/project",Emphasis towards active reproduction or renegotiation of the identity and memory of the culture/s represented (more global and fluid),Not Applicable,No,2
1336902487730.55,,Sun May 13 2012 11:48:07 GMT+0200 (CEST),,"Bibliothèque nationale de France, the Réunion des musées nationaux and the Ministère de la Culture et de la Communication",France,Various,Museum|Library,Art|Archeology|Social History|Ethnography|Natural Science|Cultural Events,"National, History and Art Museums|Contemporary Art|Local|Science and Technology|Libraries",Undefined,"http://www.cultureclic.fr/
http://www.bnf.fr/fr/acc/x.accueil.html
http://www.culturecommunication.gouv.fr/",CIID,CIID,,,CultureClic,Le guide des lieux et évènements culturels couvrant l’ensemble de la France,Undefined,Undefined,"http://www.cultureclic.fr/
http://www.youtube.com/watch?v=XtJ1ZrPu-00",,"CultureClic describes itself as \'the most complete culture-on-mobile application for France\'. It is free of chrage and available on 80% oif mobile phones with an internet connection. Features include: - 700 geolocated works in high definition (can be explored in AR mode on iPhones) - museum data sheets - events listings - AR of places such as Louvre and Eiffel Tower as they once looked - practical information for 1,350 museums ","Communication - (website) - the project or application functions to convey, present or promote the activities of the project or institution",Off Site - not related to museum premises,Before the Visit - preparation prior to the visit,Text|Audio|Image|Video|Augmented Reality,,"Audience / Public - the application is outward facing, intended as an experience for the general public, or specific community groups","A partnership between museums, a library and a cultural organisation means that this app is able to offer a wide range of content.", The app combines practical tourist information with museum and library collections.,"The application promote the collections of museums, galleries, libraries and archives through geolocated images, driving visitors to access these collections.",,Interaction with Contents,2,Immersive (focused on making visitors experience something),5,5,,This aspect of the analysis is not significant for the present case,8) None of the above,Not applicable,Not applicable,This aspect of the analysis is not significant for the present case,Not Applicable,Not Applicable,4
1336903132530.31,,Sun May 13 2012 11:58:52 GMT+0200 (CEST),,UNESCO,France,Undefined,"United Nations Educational, Scientific and Cultural Organization",Cultures,"The building of peace, the eradication of poverty, sustainable development and intercultural dialogue through education, the sciences, culture, communication and information",Undefined,http://www.unesco.org/new/en/,CIID,CIID,,,Google - UNESCO,World Heritage,Undefined ,Undefined,"http://www.google.com/intl/en/landing/unesco/
http://whc.unesco.org/en/news/570",,A partnership between UNESCO and Google which involved photographing World Heritage Sites and geolocating them on GoogleMaps.,"Interpretation - (curatorial tool, catalogue) - key function of technologies is to help in the exposition of existing informational platforms",Off Site - virtual visits|Off Site - not related to museum premises,Independent from the Visit - no relation to the visit ,Audio|Image|Video,,"Audience / Public - the application is outward facing, intended as an experience for the general public, or specific community groups",Partnership between UNESCO and Google.,"The website enables users worldwide to \'visit\' wonders such as Versailles and Stonehenge. These heritage sites are presented in a manner familiar to users of GoogleMaps and Streetview, making the system highly accessible. ","UNESCO hope that the project will make the sites accessible to all, increase awareness and encourage participation in the preservation of heritage.",,Passive Content Consumption,2,Reflective (focused on engaging visitors cognitively),5,5,,This aspect of the analysis is not significant for the present case,8) None of the above,Not applicable,,This aspect of the analysis is not significant for the present case,Not Applicable,Not Applicable,3
1336903953986.71,,Sun May 13 2012 12:12:33 GMT+0200 (CEST),,Brooklyn Museum,United States of America,New York,Museum,Art|Social History,"National, History and Art Museums|Contemporary Art|Local",2011,http://www.brooklynmuseum.org/,CIID,CIID,,,Split Second,Indian paintings,2011,Shelley Bernstein,"http://www.brooklynmuseum.org/opencollection/labs/splitsecond/
http://www.museumsandtheweb.com/mw2012/best/exhibition/split_second_indian_paintings
http://tumblr.artprize.org/post/3166760401/split-second-invites-the-brooklyn-museums-online",,"Brooklyn Museum have a strong relationship with their online community. In the latest interaction, online visitors will participate in an experimental project, which will result in a small installation. The project explores how our initial reaction to a piece of art is affected by what we know, what we’re asked, and what we’re told about the object in question. In the first-stage of the project participants will be asked to select which painting they prefer from a randomly selected pair (against the clock); in the second, they will be asked to write in their own words about a painting before rating its appeal on a scale. In the third phase, participants will be asked to rate a work of art after being given unlimited time to view it alongside a typical interpretive text. Each part of the exercise aims to examine how a different type of information—or a lack thereof—might affect a person\'s reaction to a work of art. Split Second culminates with an installation on the Museum’s second floor, opening July 13, 2011. Visitors will be able to view a small selection of the paintings that generated the most controversial and dynamic responses during the evaluation process, accompanied by a visualization and analysis of the data collected.",Featured - (exhibited) - novel or a novel application of technologies are in-themselves the primary feature of the project or exhibition,Off Site - virtual visits,Before the Visit - preparation prior to the visit,Text|Image,,"Audience / Public - the application is outward facing, intended as an experience for the general public, or specific community groups","This project combines crowdsourcing, audience building and an exhibition with an experiment - both into reactions to art, and the role technology can play in this.","Visitors will play a role in choosing the content of an installation. However, it is not individual\'s who will choose the pieces but the group as it will be the artworks that provoked the most conteoversy that go on show. Those participants who are able to visit the Brooklyn Museum will be able to see a physical manifestation of their online experience.","\'The Brooklyn Museum\'s collection of Indian paintings ranks among the top ten in the United States, representing the artistic traditions of many different regions, with examples dating from the fifteenth century to the nineteenth. Many of the works in this project have not been on view for several years, owing to their light sensitivity. The installation offers a rare opportunity to see these paintings in person.\'",,Individual interactions are networked in aggregate,5,Reflective (focused on engaging visitors cognitively)|Collaborative (focused on making visitors build knowledge together),3,2,,"Both, with respect to different parts of the museum/exhibition/project","3) Trans-Cultural Practice - facilitates, allows and encourages multiple readings and parallel interpretations of cultural dynamics",Not applicable,"Both, with respect to different parts of the museum/exhibition/project",Emphasis towards active reproduction or renegotiation of the identity and memory of the culture/s represented (more global and fluid),Yes,Yes,1
1336904694843.79,,Sun May 13 2012 12:24:54 GMT+0200 (CEST),,"Centre for Cultural Technology, New Mexico Highlands University",United States of America,New Mexico,University Arts Media Program,Research & Street Art,Street Art,2009,http://cct.newmexicoculture.org/,CIID,CIID,,,Wonderland: Paint Out,Facilitates the creation of temporary street art and graffiti & dialogue,2009,Undefined,"http://lpimaging.net/kara/index.php/paint-out/
http://www.museumsandtheweb.com/mw2010/abstracts/prg_335002405.html",,"Wonderland was a large multi-site exhibit that came out of, and responds to, the diversity of San Francisco\'s Tenderloin district. Collaboration and community engagement were key to the exhibit. Media Arts Graduates from CCT exhibited “Paint Out,” a virtual graffiti project. ‘PaintOut is a collaborative work that allows the participant to create a virtual graffiti drawing on any reflective surface. PaintOut facilitates the creation of temporary street art and graffiti, and because of this, it allows the normally marginalized street artist to participate in the current contemporary art dialogue without defacing or damaging public property.",Featured - (exhibited) - novel or a novel application of technologies are in-themselves the primary feature of the project or exhibition,On Site - in dedicated areas,During the vist - enhancing visitor experience,Image|Video,,"Audience / Public - the application is outward facing, intended as an experience for the general public, or specific community groups","Target group - Graffiti artists


The project uses technology to improve the relationship between street artists and the communities they work in. However, the students are also using the technology to ask what it means to legitimise an intentionally illegal activity in this way.","The role of the user changed through different incarnations of the exhibit. Initially, users could erase previous user\'s work, but in the latest version of it, they couldn\'t and were forced to work in the same conditions as \'real\' graffiti artists.",Undefined,,Interaction with Contents,5,Performative (focused on making visitors acting something)|Reflective (focused on engaging visitors cognitively)|Immersive (focused on making visitors experience something),3,2,,This aspect of the analysis is not significant for the present case,8) None of the above,Not applicable,Not applicable,This aspect of the analysis is not significant for the present case,Yes,Yes,1
